{
  "$schema": "https://json-schema.org/draft/2020-12/schema",
  "$id": "https://decantr.ai/schemas/shell.v1.json",
  "title": "Decantr Shell",
  "type": "object",
  "required": [
    "$schema",
    "id",
    "name"
  ],
  "properties": {
    "$schema": {
      "const": "https://decantr.ai/schemas/shell.v1.json"
    },
    "id": {
      "$ref": "https://decantr.ai/schemas/common.v1.json#/$defs/nonEmptyString"
    },
    "name": {
      "$ref": "https://decantr.ai/schemas/common.v1.json#/$defs/nonEmptyString"
    },
    "description": {
      "type": "string"
    },
    "root": {
      "type": "string"
    },
    "nav": {
      "type": "string"
    },
    "header": {
      "type": "string"
    },
    "nav_style": {
      "type": "string"
    },
    "dimensions": {
      "type": [
        "object",
        "null"
      ],
      "additionalProperties": true
    },
    "layout": {
      "type": "string"
    },
    "atoms": {
      "type": "string",
      "description": "Legacy @decantr/css adapter hint. Contract-only and style-bridge workflows ignore this field."
    },
    "config": {
      "type": "object",
      "additionalProperties": true
    },
    "configurable": {
      "type": "object",
      "additionalProperties": true
    },
    "guidance": {
      "$ref": "https://decantr.ai/schemas/common.v1.json#/$defs/stringMap"
    },
    "internal_layout": {
      "type": "object",
      "description": "Semantic shell-region layout. Nested atoms fields are legacy adapter hints and are not emitted as contract-only styling instructions.",
      "additionalProperties": true
    },
    "code": {
      "$ref": "https://decantr.ai/schemas/common.v1.json#/$defs/codeSpec"
    }
  },
  "additionalProperties": true
}
