{
  "id": "sidebar-main",
  "code": {
    "example": "function SidebarMain({ nav, children }) {\n  const { div, aside, main, header, span } = tags;\n  const [collapsed, setCollapsed] = createSignal(false);\n\n  return div({ class: css('_grid _h[100vh]'), style: () => `grid-template-columns:${collapsed() ? '64px' : '240px'} 1fr;grid-template-rows:auto 1fr` },\n    // Sidebar\n    aside({ class: css('_flex _col _gap1 _p3 _bgmuted _overflow[auto] _borderR'), style: 'grid-row:1/3' },\n      div({ class: css('_flex _aic _jcsb _mb4') },\n        !collapsed() ? span({ class: css('_heading5') }, 'App') : null,\n        Button({ variant: 'ghost', size: 'sm', onclick: () => setCollapsed(!collapsed()) },\n          icon('panel-left')\n        )\n      ),\n      ...nav.map(item =>\n        link({ href: item.href, class: css('_flex _aic _gap2 _p2 _px3 _r2 _trans _fgfg') },\n          icon(item.icon),\n          !collapsed() ? text(() => item.label) : null\n        )\n      )\n    ),\n    // Header\n    header({ class: css('_flex _aic _jcsb _px6 _py3 _borderB') },\n      span({ class: css('_heading4') }, 'Page Title'),\n      div({ class: css('_flex _aic _gap2') })\n    ),\n    // Main content\n    main({ class: css('_flex _col _gap4 _p6 _overflow[auto] _flex1') },\n      ...children\n    )\n  );\n}",
    "imports": "import { tags } from 'decantr/tags';\nimport { h, text, onMount, onDestroy } from 'decantr/core';\nimport { createSignal } from 'decantr/state';\nimport { css } from 'decantr/css';\nimport { link, useRoute } from 'decantr/router';\nimport { Button, icon } from 'decantr/components';"
  },
  "name": "Sidebar + Main",
  "atoms": "_grid _h[100vh]",
  "config": {
    "nav": {
      "width": "240px",
      "position": "left",
      "collapseTo": "64px",
      "collapseBelow": "md"
    },
    "body": {
      "scroll": true
    },
    "grid": {
      "areas": [
        [
          "nav",
          "header"
        ],
        [
          "nav",
          "body"
        ]
      ]
    },
    "header": {
      "height": "52px",
      "sticky": true
    },
    "regions": [
      "header",
      "nav",
      "body"
    ]
  },
  "layout": "grid",
  "$schema": "https://decantr.ai/schemas/shell.v1.json",
  "guidance": {
    "hotkeys": "Navigation hotkeys defined in the essence are keyboard shortcuts. Implement as useEffect keydown event listeners — do NOT render hotkey text in the sidebar UI.",
    "collapse": "Sidebar collapse toggle should be integrated into the sidebar header area (next to the brand/logo), not floating at the bottom of the sidebar.",
    "breadcrumbs": "For nested routes (e.g., /resource/:id), show a breadcrumb trail above the page heading inside the main content area.",
    "empty_states": "When a section has zero data, show a centered empty state: 48px muted icon + descriptive message + optional CTA button.",
    "section_labels": "Dashboard section labels should use the d-label class. Anchor with a left accent border: border-left: 2px solid var(--d-accent); padding-left: 0.5rem.",
    "section_density": "Dashboard sections use compact spacing. Apply data-density='compact' on d-section elements for tighter vertical rhythm than marketing pages.",
    "page_transitions": "Apply the entrance-fade class (if generated) to the main content area for smooth page transitions."
  },
  "description": "Collapsible sidebar with header bar and scrollable main content area. Used by saas-dashboard, financial-dashboard, workbench, ecommerce (account pages).",
  "configurable": {
    "nav": {
      "modes": [
        "full",
        "rail",
        "hidden"
      ],
      "positions": [
        "left",
        "right",
        "top"
      ]
    },
    "aside": {
      "toggleable": true
    },
    "footer": {
      "toggleable": true
    },
    "header": {
      "positions": [
        "viewport",
        "body"
      ],
      "toggleable": true
    },
    "sizing": {
      "asideWidth": {
        "max": 480,
        "min": 200,
        "default": 280
      },
      "headerHeight": {
        "max": 80,
        "min": 36,
        "default": 52
      },
      "sidebarWidth": {
        "max": 400,
        "min": 48,
        "default": 240
      }
    }
  },
  "internal_layout": {
    "body": {
      "flex": "1",
      "note": "Sole scroll container. Page content renders directly here. No wrapper div around outlet.",
      "atoms": "_flex1 _overflow[auto] _p6",
      "padding": "1.5rem",
      "overflow_y": "auto"
    },
    "root": {
      "atoms": "_flex _h[100vh]",
      "height": "100vh",
      "display": "flex",
      "direction": "row"
    },
    "header": {
      "align": "center",
      "border": "bottom",
      "height": "52px",
      "display": "flex",
      "justify": "space-between",
      "padding": "0 1.5rem",
      "left_content": "Breadcrumb — omit segment when it equals page title",
      "button_sizing": "Buttons in the header use compact sizing: py-1.5 px-3 text-sm (~32px tall). The header is a tight 52px bar — default d-interactive padding is too large here.",
      "right_content": "Theme toggle (sun/moon icon) + Search/command trigger. Theme toggle toggles light/dark class on html element."
    },
    "sidebar": {
      "nav": {
        "flex": "1",
        "padding": "0.5rem",
        "item_gap": "2px",
        "group_gap": "0.5rem",
        "overflow_y": "auto",
        "item_content": "icon (16px) + label text. Collapsed: icon only, text hidden.",
        "item_padding": "0.375rem 0.75rem",
        "item_treatment": "d-interactive[ghost]",
        "group_header_treatment": "d-label"
      },
      "atoms": "_flex _col _borderR",
      "brand": {
        "align": "center",
        "border": "bottom",
        "height": "52px",
        "content": "Logo/brand + collapse toggle",
        "display": "flex",
        "padding": "0 1rem"
      },
      "width": "240px",
      "border": "right",
      "footer": {
        "border": "top",
        "content": "User avatar + settings link",
        "padding": "0.5rem",
        "position_within": "bottom (mt-auto)"
      },
      "position": "left",
      "direction": "column",
      "background": "var(--d-surface)",
      "collapsed_width": "64px",
      "collapse_breakpoint": "md"
    },
    "main_wrapper": {
      "flex": "1",
      "atoms": "_flex _col _flex1 _overflow[hidden]",
      "overflow": "hidden",
      "direction": "column"
    }
  }
}